### ISSUE TITLE
No connections.

### ISSUE THREAD

**Issue by lapsednun** [aria2/aria2#1095]
Hi all.

I'm a bit stuck trying to seed a 70GB torrent on a corporate LAN. Nothing is blocked internally port-wise and when I last did this a year ago it all worked perfectly.

Created and seeding a torrent with Qbittorrent.

Launching aria2c on the host machines:  Can connect to the tracker but no other connections are made to the torrent.

DHT is enabled.

Any suggestions gratefully received!

arialog file attached.

[arialog.txt](https://github.com/aria2/aria2/files/1579887/arialog.txt)

424	13:33:54 21/12/2017	156.9618695	Unavailable	192.168.212.128	aero-torrent.me.*.ac.uk	TCP	TCP:Flags=......S., SrcPort=49709, DstPort=9000, PayloadLen=0, Seq=3182952839, Ack=0, Win=8192 ( Negotiating scale factor 0x8 ) = 8192	{TCP:62, IPv4:24}
427	13:33:54 21/12/2017	156.9655846	Unavailable	aero-torrent.me.*.ac.uk	192.168.212.128	TCP	TCP:Flags=...A..S., SrcPort=9000, DstPort=49709, PayloadLen=0, Seq=4245588898, Ack=3182952840, Win=64240 ( Scale factor not supported ) = 64240	{TCP:62, IPv4:24}
428	13:33:54 21/12/2017	156.9657148	Unavailable	192.168.212.128	aero-torrent.me.ic.ac.uk	TCP	TCP:Flags=...A...., SrcPort=49709, DstPort=9000, PayloadLen=0, Seq=3182952840, Ack=4245588899, Win=64240 (scale factor 0x0) = 64240	{TCP:62, IPv4:24}
429	13:33:54 21/12/2017	156.9722512	Unavailable	192.168.212.128	aero-torrent.me.*.ac.uk	HTTP	HTTP:	{HTTP:63, TCP:62, IPv4:24}
430	13:33:54 21/12/2017	156.9726655	Unavailable	aero-torrent.me.*.ac.uk	192.168.212.128	TCP	TCP:Flags=...A...., SrcPort=9000, DstPort=49ic709, PayloadLen=0, Seq=4245588899, Ack=3182953224, Win=64240 (scale factor 0x0) = 64240	{TCP:62, IPv4:24}
431	13:33:54 21/12/2017	156.9734670	Unavailable	aero-torrent.me.*.ac.uk	192.168.212.128	HTTP	HTTP:Response, HTTP/1.1, Status: Ok, URL: /announce	{HTTP:63, TCP:62, IPv4:24}
432	13:33:54 21/12/2017	156.9736116	Unavailable	192.168.212.128	aero-torrent.me.*.ac.uk	TCP	TCP:Flags=...A...., SrcPort=49709, DstPort=9000, PayloadLen=0, Seq=3182953224, Ack=4245589086, Win=64054 (scale factor 0x0) = 64054	{TCP:62, IPv4:24}
509	13:34:26 21/12/2017	189.2955254	Unavailable	192.168.212.128	aero-torrent.me.*.ac.uk	TCP	TCP:Flags=...A...F, SrcPort=49709, DstPort=9000, PayloadLen=0, Seq=3182953224, Ack=4245589086, Win=64054 (scale factor 0x0) = 64054	{TCP:62, IPv4:24}
510	13:34:26 21/12/2017	189.2961079	Unavailable	aero-torrent.me.*.ac.uk	192.168.212.128	TCP	TCP:Flags=...A...., SrcPort=9000, DstPort=49709, PayloadLen=0, Seq=4245589086, Ack=3182953225, Win=64239 (scale factor 0x0) = 64239	{TCP:62, IPv4:24}

thanks

Steve

**Comment by tatsuhiro-t** [comment]
The log says that aria2 attempted to connect to ::ffff:*.198.138.94:6933, but it was timed out.
Is it qbittorrent's address?

**Comment by lapsednun** [comment]
Hi tatsuhiro-t .

No, *.198.138.94 isn't qbittorrent's address. It's the address of the machine I was running Aria from!
